{
    "$schema": "https://json-schema.org/draft/2020-12/schema",
    "$id": "tileset.schema.json",
    "title": "Tileset",
    "type": "object",
    "description": "A 3D Tiles tileset.",
    "allOf": [
        {
            "$ref": "rootProperty.schema.json"
        }
    ],
    "properties": {
        "asset": {
            "description": "Metadata about the entire tileset.",
            "$ref": "asset.schema.json"
        },
        "properties": {
            "type": "object",
            "description": "A dictionary object of metadata about per-feature properties.",
            "additionalProperties": {
                "$ref": "properties.schema.json"
            },
            "deprecated": true
        },
        "schema": {
            "allOf": [
                {
                    "$ref": "schema.schema.json"
                }
            ],
            "description": "An object defining classes and enums."
        },
        "schemaUri": {
            "type": "string",
            "description": "The URI (or IRI) of the external schema file.",
            "format": "iri-reference"
        },
        "statistics": {
            "allOf": [
                {
                    "$ref": "statistics.schema.json"
                }
            ],
            "description": "An object containing statistics about entities."
        },
        "groups": {
            "type": "array",
            "description": "An array of groups.",
            "items": {
                "$ref": "group.schema.json"
            },
            "minItems": 1
        },
        "metadata": {
            "allOf": [
                {
                    "$ref": "metadataEntity.schema.json"
                }
            ],
            "description": "Tileset metadata."            
        },
        "geometricError": {
            "type": "number",
            "description": "The error, in meters, introduced if this tileset is not rendered. At runtime, the geometric error is used to compute screen space error (SSE), i.e., the error measured in pixels.",
            "minimum": 0
        },
        "root": {
            "description": "The root tile.",
            "$ref": "tile.schema.json"
        },
        "extensionsUsed": {
            "type": "array",
            "description": "Names of 3D Tiles extensions used somewhere in this tileset.",
            "items": {
                "type": "string"
            },
            "uniqueItems": true,
            "minItems": 1
        },
        "extensionsRequired": {
            "type": "array",
            "description": "Names of 3D Tiles extensions required to properly load this tileset.",
            "items": {
                "type": "string"
            },
            "uniqueItems": true,
            "minItems": 1
        },
        "extensions": {},
        "extras": {}
    },
    "required": [
        "asset",
        "geometricError",
        "root"
    ],
    "oneOf": [
        {
            "description": "External schema, if any.",
            "not": {
                "required": [
                    "schema"
                ]
            }
        },
        {
            "description": "Internal schema, if any.",
            "not": {
                "required": [
                    "schemaUri"
                ]
            }
        }
    ]
}