{
  "asset": {
    "title": "Bermuda Triangle Example",
    "version": "1.1"
  },
  "schema": {
    "id": "ExampleSchema",
    "classes": {
      "tileset": {
        "properties": {
          "content_type": {
            "default": "MESH",
            "name": "Content Type",
            "optional": true,
            "type": "STRING"
          },
          "geometry_model": {
            "default": "SURFACE",
            "name": "Geometry Model",
            "optional": true,
            "type": "STRING"
          },
          "name": {
            "name": "Name of dataset",
            "optional": true,
            "type": "STRING"
          },
          "schema": {
            "name": "WFF Schema identifier",
            "optional": true,
            "type": "STRING"
          },
          "wff_version": {
            "default": "1.5",
            "name": "WFF Schema version",
            "optional": false,
            "type": "STRING"
          }

        }
      }
    }
  },
  "groups": [{
      "class": "tileset",
      "properties": {
        "content_type": "VECTOR",
        "geometry_model": "OBJECTS",
        "name": "Bermuda Triangle",
        "schema": "wff/15",
        "wff_version": "1.5"
      }
    }, {
      "class": "tileset",
      "properties": {
        "content_type": "VECTOR",
        "geometry_model": "OBJECTS",
        "name": "Bermuda Ships",
        "schema": "wff/15",
        "wff_version": "1.5"
      },
      "extensions": {
        "MAXAR_content_geojson": {
          "propertiesSchemaUri": "ships_schema.json"
        }
      }
    }, {
      "class": "tileset",
      "properties": {
        "content_type": "VECTOR",
        "geometry_model": "OBJECTS",
        "name": "Bermuda Planes",
        "schema": "wff/15",
        "wff_version": "1.5"
      },
      "extensions": {
        "MAXAR_content_geojson": {
          "propertiesSchemaUri": "planes_schema.json"
        }
      }
    }
  ],
  "metadata": {
    "class": "tileset",
    "properties": {
      "content_type": "MIXED",
      "geometry_model": "MIXED",
      "name": "Bermuda Example",
      "schema": "wff/15",
      "wff_version": "1.5"
    }
  },
  "extensions": {
    "MAXAR_content_geojson": {}
  },
  "extensionsRequired": [
    "MAXAR_content_geojson"
  ],
  "extensionsUsed": [
    "MAXAR_content_geojson"
  ],
  "geometricError": 0,
  "root": {
    "boundingVolume": {
      "region": [
        -1.4006267247,
        0.22980174302,
        -1.0396345159,
        0.68573008926,
        -250.0,
        250.0
      ]
    },
    "geometricError": 0,
    "refine": "REPLACE",
    "children": [{
        "boundingVolume": {
          "region": [
            -1.399904333,
            0.321252109,
            -1.129926158,
            0.564090414,
            -250.0,
            250.0
          ]
        },
        "content": {
          "group": 0,
          "uri": "0_triangle.json"
        },
        "geometricError": 0,
        "refine": "ADD"
      }, {
        "boundingVolume": {
          "region": [
            -1.337188893,
            0.229801743,
            -1.039634516,
            0.685730089,
            -250.0,
            250.0
          ]
        },
        "content": {
          "group": 1,
          "uri": "0_ships.json"
        },
        "geometricError": 0,
        "refine": "ADD"
      }, {
        "boundingVolume": {
          "region": [
            -1.400626725,
            0.390081088,
            -1.128905629,
            0.564867574,
            -250.0,
            250.0
          ]
        },
        "content": {
          "group": 2,
          "uri": "0_planes.json"
        },
        "geometricError": 0,
        "refine": "ADD"
      }
    ]
  }
}
