{
  "asset": {
    "version": "1.0"
  },
  "geometricError": 10000,
  "extensionsUsed": [
    "3DTILES_implicit_tiling"
  ],
  "extensionsRequired": [
    "3DTILES_implicit_tiling"
  ],
  "root": {
    "boundingVolume": {
      "region": [-1.318, 0.697, -1.319, 0.698, 0, 20]
    },
    "refine": "ADD",
    "geometricError": 5000,
    "content": {
      "uri": "content/{level}/{x}/{y}.b3dm"
    },
    "extensions": {
      "3DTILES_implicit_tiling": {
        "subdivisionScheme": "QUADTREE",
        "subtreeLevels": 3,
        "maximumLevel": 2,
        "subtrees": {
          "uri": "subtrees/{level}/{x}/{y}.subtree"
        }
      }
    }  
  }
}
