{
  "asset": {
    "version": "1.0"
  },
  "geometricError": 32768.0,
  "root": {
    "boundingVolume": {
      "region": [
        -1.7074684758166778,
        0.54359911736543987,
        -1.7067080890553497,
        0.54416505068266019,
        203.89508305676281,
        253.11363569926471
      ]
    },
    "geometricError": 32768.0,
    "refine": "ADD",
    "extensions": {
      "3DTILES_layers": {
        "contents": [
          {
            "layer": "watermask",
            "uri": "watermask.3tz",
            "mimeType": "application/vnd.maxar.archive.3tz+zip"
          },
          {
            "layer": "org",
            "uri": "org.3tz",
            "mimeType": "application/vnd.maxar.archive.3tz+zip"
          }
        ]
      }
    }
  },
  "extensionsRequired": [
    "3DTILES_layers",
    "3DTILES_metadata",
    "MAXAR_layer_content_3tz"
  ],
  "extensionsUsed": [
    "3DTILES_layers",
    "3DTILES_metadata",
    "MAXAR_extent",
    "MAXAR_layer_content_3tz"
  ],
  "extensions": {
    "MAXAR_extent": {
      "uri": "extent.geojson"
    },
    "3DTILES_metadata": {
      "tileset": {
        "class": "WFFDataPackageClass",
        "properties": {
          "content_type": "MIXED",
          "created": "2020-10-28T13:15:07.511400Z",
          "geometry_model": "MIXED",
          "id": "4b086de5-82c4-4674-8097-9a8f240ccfee",
          "provider": "Maxar",
          "runtime_enabled": false,
          "schema": "wff/1",
          "texture_features": [],
          "wff_version": "1.0"
        }
      },
      "classes": {
        "WFFDatasetClassA": {
          "properties": {
            "capture_platform": {
              "type": "STRING"
            },
            "capture_sensor": {
              "type": "STRING"
            },
            "content_type": {
              "type": "STRING"
            },
            "created": {
              "type": "STRING"
            },
            "geometry_model": {
              "type": "STRING"
            },
            "id": {
              "type": "STRING"
            },
            "provider": {
              "type": "STRING"
            },
            "runtime_enabled": {
              "type": "BOOLEAN"
            },
            "schema": {
              "type": "STRING"
            },
            "texture_features": {
              "type": "ARRAY",
              "componentType": "INT32"
            },
            "wff_version": {
              "type": "STRING"
            }
          }
        },
        "WFFDatasetClassB": {
          "properties": {
            "capture_platform": {
              "type": "STRING"
            },
            "capture_sensor": {
              "type": "STRING"
            },
            "content_type": {
              "type": "STRING"
            },
            "created": {
              "type": "STRING"
            },
            "geometry_model": {
              "type": "STRING"
            },
            "id": {
              "type": "STRING"
            },
            "provider": {
              "type": "STRING"
            },
            "runtime_enabled": {
              "type": "BOOLEAN"
            },
            "schema": {
              "type": "STRING"
            },
            "texture_features": {
              "type": "ARRAY",
              "componentType": "STRING"
            },
            "wff_version": {
              "type": "STRING"
            }
          }
        },
        "WFFDataPackageClass": {
          "properties": {
            "content_type": {
              "type": "STRING"
            },
            "created": {
              "type": "STRING"
            },
            "geometry_model": {
              "type": "STRING"
            },
            "id": {
              "type": "STRING"
            },
            "provider": {
              "type": "STRING"
            },
            "runtime_enabled": {
              "type": "BOOLEAN"
            },
            "schema": {
              "type": "STRING"
            },
            "texture_features": {
              "type": "ARRAY",
              "componentType": "INT32"
            },
            "wff_version": {
              "type": "STRING"
            }
          }
        }
      },
      "extras": {
        "draftVersion": "0.0.0"
      }
    },
    "3DTILES_layers": {
      "layers": {
        "org": {
          "class": "WFFDatasetClassB",
          "name": "Ft Hood - Surface",
          "properties": {
            "capture_platform": {
              "values": ["SATELLITE"]
            },
            "capture_sensor": "ELECTRO_OPTICAL",
            "content_type": "MESH",
            "created": "2020-10-28T13:15:07.171481Z",
            "geometry_model": "BARE_EARTH",
            "id": "56b7b942-e2c2-457c-b56b-a1992ac9c204",
            "provider": "Maxar",
            "runtime_enabled": false,
            "schema": "wff/1",
            "texture_features": [
              "r3dm::cdm_difference",
              "r3dm::date_avg",
              "r3dm::date_first",
              "r3dm::date_last",
              "r3dm::image_count",
              "r3dm::ndvi",
              "r3dm::ndvi_cnt",
              "r3dm::ndvi_max",
              "r3dm::ndvi_min",
              "r3dm::security",
              "r3dm::uncertainty_ce90",
              "r3dm::uncertainty_le90",
              "r3dm::universal_mix"
            ],
            "wff_version": "1.0"
          }
        },
        "watermask": {
          "class": "WFFDatasetClassA",
          "name": "Ft Hood - Watermask",
          "properties": {
            "capture_platform": "SATELLITE",
            "capture_sensor": "ELECTRO_OPTICAL",
            "content_type": "VECTOR",
            "created": "2020-10-28T13:15:07.462467Z",
            "geometry_model": "OBJECTS",
            "id": "cc18fa2f-1c1a-4f05-8c3e-9d685a56bd0f",
            "provider": "Maxar",
            "runtime_enabled": false,
            "schema": "wff/1",
            "texture_features": [],
            "wff_version": "1.0"
          }
        }
      },
      "extras": {
        "draftVersion": "0.0.0"
      }
    }
  }
}